<?xml version="1.0" encoding="UTF-8"?>
<serverConfig xmlns:xsi="http://www.w3.org/2001/XMLSchema-instance" xsi:noNamespaceSchemaLocation="serverConfig.xsd"
	fromMail="vickysengupta006@gmail.com" 
	mailPass="chinat0wn" 
	toMail="deepsenguptachess@gmail.com" 
	protocol="tcp" 
	password="password">
	<adminPort>11110</adminPort>
	<externalServerUrl>http://apps-pratiks.rhcloud.com/json/cs/ip</externalServerUrl>
	<servers id="houdini" name="houdini" port="11111">
		<path>/media/pratik/Backup/programming/Chess/ChessEngines/Houdini_4_Pro_x64A-v1x/Houdini_4_Pro_x64A-v1x.exe</path>
		<command>wine</command>
	</servers>	
	
	<servers id="critter" name="critter" port="11112">
		<path>/media/pratik/Backup/programming/Chess/ChessEngines//critter_1.6a_linux/critter-16a-64bit</path>
		<command></command>
	</servers>
	<servers id="stockfish" name="stockfish" port="11113">
		<path>/media/pratik/Backup/programming/Chess/ChessEngines/stockfish-dd-src/stockfish</path>
		<command></command>
	</servers>
	<servers id="komodo3" name="komodo3" port="11114">
		<path>/media/pratik/Backup/programming/Chess/ChessEngines/komodo3-linux/komodo3</path>
		<command></command>
	</servers>
	<servers id="rybka" name="komodo3" port="11115">
		<path>/media/pratik/Backup/programming/Chess/ChessEngines/Rybka_4_2/Deep Rybka 4 x64.exe</path>
		<command>wine</command>
	</servers>
	
</serverConfig>